<?xml version="1.0" encoding="UTF-8"?>
<?xml-stylesheet type="text/xsl" href="sales.xsl"?>
<MobileSales xmlns:xsi="http://www.w3.org/2001/XMLSchema-instance" xsi:noNamespaceSchemaLocation="sales.xsd">
    <Mobile>
        <ModelName>Moto G</ModelName>
        <ModelID>1234</ModelID>
        <Brand>Motorola</Brand>
        <Price>4000</Price>
        <Color>Black</Color>
        <SIMSize>Micro</SIMSize>
        <Memory>8GB</Memory>
        <Camera>Yes</Camera>
        <TouchScreen>Yes</TouchScreen>
        <NoSold>11</NoSold>
        <storeName>store1</storeName>
    </Mobile>
    <Mobile>
        <ModelName>Canvas</ModelName>
        <ModelID>3452</ModelID>
        <Brand>Micromax</Brand>
        <Price>7000</Price>
        <Color>Black</Color>
        <SIMSize>Micro</SIMSize>
        <Memory>8GB</Memory>
        <Camera>Yes</Camera>
        <TouchScreen>Yes</TouchScreen>
        <NoSold>6</NoSold>
        <storeName>store1</storeName>
    </Mobile>
    <Mobile>
        <ModelName>A6000</ModelName>
        <ModelID>6878</ModelID>
        <Brand>Lenovo</Brand>
        <Price>6000</Price>
        <Color>White</Color>
        <SIMSize>Nano</SIMSize>
        <Memory>4GB</Memory>
        <Camera>Yes</Camera>
        <TouchScreen>Yes</TouchScreen>
        <NoSold>8</NoSold>
        <storeName>store1</storeName>
    </Mobile>
    <Mobile>
        <ModelName>Canvas</ModelName>
        <ModelID>3452</ModelID>
        <Brand>Micromax</Brand>
        <Price>7000</Price>
        <Color>Black</Color>
        <SIMSize>Micro</SIMSize>
        <Memory>8GB</Memory>
        <Camera>Yes</Camera>
        <TouchScreen>Yes</TouchScreen>
        <NoSold>17</NoSold>
        <storeName>store2</storeName>
    </Mobile>
</MobileSales>